{
 "dataset": "us/tariffs/eia_state_average",
 "kind": "tariff",
 "source": {
  "name": "EIA Electricity Retail Sales (Forms EIA-826, EIA-861, EIA-861M)",
  "publisher": "US Energy Information Administration",
  "url": "https://www.eia.gov/opendata/browser/electricity/retail-sales",
  "license": "Public domain (US Government work)",
  "notes": "EIA does not state whether revenue includes taxes, so taxes_included is null."
 },
 "fetched_at": "2026-10-10T14:20:34Z",
 "count": 52,
 "records": [
  {
   "id": "us-eia-AK",
   "country": "US",
   "region": {
    "type": "state",
    "code": "AK",
    "name": "Alaska"
   },
   "utility": null,
   "currency": "USD",
   "price_per_kwh": 0.2685,
   "price_basis": "Average residential price: sum of EIA residential revenue / sum of residential sales, 2025-08 to 2026-07. An average across all residential customers as reported to EIA, not a specific tariff.",
   "taxes_included": null,
   "period": {
    "from": "2025-08",
    "to": "2026-07"
   },
   "source_record_id": "retail-sales/RES/AK/2025-08..2026-07"
  },
  {
   "id": "us-eia-AL",
   "country": "US",
   "region": {
    "type": "state",
    "code": "AL",
    "name": "Alabama"
   },
   "utility": null,
   "currency": "USD",
   "price_per_kwh": 0.1644,
   "price_basis": "Average residential price: sum of EIA residential revenue / sum of residential sales, 2025-08 to 2026-07. An average across all residential customers as reported to EIA, not a specific tariff.",
   "taxes_included": null,
   "period": {
    "from": "2025-08",
    "to": "2026-07"
   },
   "source_record_id": "retail-sales/RES/AL/2025-08..2026-07"
  },
  {
   "id": "us-eia-AR",
   "country": "US",
   "region": {
    "type": "state",
    "code": "AR",
    "name": "Arkansas"
   },
   "utility": null,
   "currency": "USD",
   "price_per_kwh": 0.1343,
   "price_basis": "Average residential price: sum of EIA residential revenue / sum of residential sales, 2025-08 to 2026-07. An average across all residential customers as reported to EIA, not a specific tariff.",
   "taxes_included": null,
   "period": {
    "from": "2025-08",
    "to": "2026-07"
   },
   "source_record_id": "retail-sales/RES/AR/2025-08..2026-07"
  },
  {
   "id": "us-eia-AZ",
   "country": "US",
   "region": {
    "type": "state",
    "code": "AZ",
    "name": "Arizona"
   },
   "utility": null,
   "currency": "USD",
   "price_per_kwh": 0.154,
   "price_basis": "Average residential price: sum of EIA residential revenue / sum of residential sales, 2025-08 to 2026-07. An average across all residential customers as reported to EIA, not a specific tariff.",
   "taxes_included": null,
   "period": {
    "from": "2025-08",
    "to": "2026-07"
   },
   "source_record_id": "retail-sales/RES/AZ/2025-08..2026-07"
  },
  {
   "id": "us-eia-CA",
   "country": "US",
   "region": {
    "type": "state",
    "code": "CA",
    "name": "California"
   },
   "utility": null,
   "currency": "USD",
   "price_per_kwh": 0.3299,
   "price_basis": "Average residential price: sum of EIA residential revenue / sum of residential sales, 2025-08 to 2026-07. An average across all residential customers as reported to EIA, not a specific tariff.",
   "taxes_included": null,
   "period": {
    "from": "2025-08",
    "to": "2026-07"
   },
   "source_record_id": "retail-sales/RES/CA/2025-08..2026-07"
  },
  {
   "id": "us-eia-CO",
   "country": "US",
   "region": {
    "type": "state",
    "code": "CO",
    "name": "Colorado"
   },
   "utility": null,
   "currency": "USD",
   "price_per_kwh": 0.1631,
   "price_basis": "Average residential price: sum of EIA residential revenue / sum of residential sales, 2025-05 to 2026-04. An average across all residential customers as reported to EIA, not a specific tariff.",
   "taxes_included": null,
   "period": {
    "from": "2025-05",
    "to": "2026-04"
   },
   "source_record_id": "retail-sales/RES/CO/2025-05..2026-04"
  },
  {
   "id": "us-eia-CT",
   "country": "US",
   "region": {
    "type": "state",
    "code": "CT",
    "name": "Connecticut"
   },
   "utility": null,
   "currency": "USD",
   "price_per_kwh": 0.2799,
   "price_basis": "Average residential price: sum of EIA residential revenue / sum of residential sales, 2025-08 to 2026-07. An average across all residential customers as reported to EIA, not a specific tariff.",
   "taxes_included": null,
   "period": {
    "from": "2025-08",
    "to": "2026-07"
   },
   "source_record_id": "retail-sales/RES/CT/2025-08..2026-07"
  },
  {
   "id": "us-eia-DC",
   "country": "US",
   "region": {
    "type": "state",
    "code": "DC",
    "name": "District of Columbia"
   },
   "utility": null,
   "currency": "USD",
   "price_per_kwh": 0.242,
   "price_basis": "Average residential price: sum of EIA residential revenue / sum of residential sales, 2025-08 to 2026-07. An average across all residential customers as reported to EIA, not a specific tariff.",
   "taxes_included": null,
   "period": {
    "from": "2025-08",
    "to": "2026-07"
   },
   "source_record_id": "retail-sales/RES/DC/2025-08..2026-07"
  },
  {
   "id": "us-eia-DE",
   "country": "US",
   "region": {
    "type": "state",
    "code": "DE",
    "name": "Delaware"
   },
   "utility": null,
   "currency": "USD",
   "price_per_kwh": 0.1779,
   "price_basis": "Average residential price: sum of EIA residential revenue / sum of residential sales, 2025-08 to 2026-07. An average across all residential customers as reported to EIA, not a specific tariff.",
   "taxes_included": null,
   "period": {
    "from": "2025-08",
    "to": "2026-07"
   },
   "source_record_id": "retail-sales/RES/DE/2025-08..2026-07"
  },
  {
   "id": "us-eia-FL",
   "country": "US",
   "region": {
    "type": "state",
    "code": "FL",
    "name": "Florida"
   },
   "utility": null,
   "currency": "USD",
   "price_per_kwh": 0.1539,
   "price_basis": "Average residential price: sum of EIA residential revenue / sum of residential sales, 2025-08 to 2026-07. An average across all residential customers as reported to EIA, not a specific tariff.",
   "taxes_included": null,
   "period": {
    "from": "2025-08",
    "to": "2026-07"
   },
   "source_record_id": "retail-sales/RES/FL/2025-08..2026-07"
  },
  {
   "id": "us-eia-GA",
   "country": "US",
   "region": {
    "type": "state",
    "code": "GA",
    "name": "Georgia"
   },
   "utility": null,
   "currency": "USD",
   "price_per_kwh": 0.1512,
   "price_basis": "Average residential price: sum of EIA residential revenue / sum of residential sales, 2025-08 to 2026-07. An average across all residential customers as reported to EIA, not a specific tariff.",
   "taxes_included": null,
   "period": {
    "from": "2025-08",
    "to": "2026-07"
   },
   "source_record_id": "retail-sales/RES/GA/2025-08..2026-07"
  },
  {
   "id": "us-eia-HI",
   "country": "US",
   "region": {
    "type": "state",
    "code": "HI",
    "name": "Hawaii"
   },
   "utility": null,
   "currency": "USD",
   "price_per_kwh": 0.4351,
   "price_basis": "Average residential price: sum of EIA residential revenue / sum of residential sales, 2025-08 to 2026-07. An average across all residential customers as reported to EIA, not a specific tariff.",
   "taxes_included": null,
   "period": {
    "from": "2025-08",
    "to": "2026-07"
   },
   "source_record_id": "retail-sales/RES/HI/2025-08..2026-07"
  },
  {
   "id": "us-eia-IA",
   "country": "US",
   "region": {
    "type": "state",
    "code": "IA",
    "name": "Iowa"
   },
   "utility": null,
   "currency": "USD",
   "price_per_kwh": 0.1413,
   "price_basis": "Average residential price: sum of EIA residential revenue / sum of residential sales, 2025-08 to 2026-07. An average across all residential customers as reported to EIA, not a specific tariff.",
   "taxes_included": null,
   "period": {
    "from": "2025-08",
    "to": "2026-07"
   },
   "source_record_id": "retail-sales/RES/IA/2025-08..2026-07"
  },
  {
   "id": "us-eia-ID",
   "country": "US",
   "region": {
    "type": "state",
    "code": "ID",
    "name": "Idaho"
   },
   "utility": null,
   "currency": "USD",
   "price_per_kwh": 0.1265,
   "price_basis": "Average residential price: sum of EIA residential revenue / sum of residential sales, 2025-08 to 2026-07. An average across all residential customers as reported to EIA, not a specific tariff.",
   "taxes_included": null,
   "period": {
    "from": "2025-08",
    "to": "2026-07"
   },
   "source_record_id": "retail-sales/RES/ID/2025-08..2026-07"
  },
  {
   "id": "us-eia-IL",
   "country": "US",
   "region": {
    "type": "state",
    "code": "IL",
    "name": "Illinois"
   },
   "utility": null,
   "currency": "USD",
   "price_per_kwh": 0.1879,
   "price_basis": "Average residential price: sum of EIA residential revenue / sum of residential sales, 2025-08 to 2026-07. An average across all residential customers as reported to EIA, not a specific tariff.",
   "taxes_included": null,
   "period": {
    "from": "2025-08",
    "to": "2026-07"
   },
   "source_record_id": "retail-sales/RES/IL/2025-08..2026-07"
  },
  {
   "id": "us-eia-IN",
   "country": "US",
   "region": {
    "type": "state",
    "code": "IN",
    "name": "Indiana"
   },
   "utility": null,
   "currency": "USD",
   "price_per_kwh": 0.1694,
   "price_basis": "Average residential price: sum of EIA residential revenue / sum of residential sales, 2025-08 to 2026-07. An average across all residential customers as reported to EIA, not a specific tariff.",
   "taxes_included": null,
   "period": {
    "from": "2025-08",
    "to": "2026-07"
   },
   "source_record_id": "retail-sales/RES/IN/2025-08..2026-07"
  },
  {
   "id": "us-eia-KS",
   "country": "US",
   "region": {
    "type": "state",
    "code": "KS",
    "name": "Kansas"
   },
   "utility": null,
   "currency": "USD",
   "price_per_kwh": 0.1509,